Defect ID,Feature ID,Description,Reproduction Steps,Expected Result,Actual Result,Severity,Root Cause Hypothesis,Status
DEF-001,F017,"npm run lint fails with react-hooks/set-state-in-effect error in use-preferences.ts","Run `npm run lint`","Lint passes (CI gate green)","Error at use-preferences.ts:46 - setState called synchronously in effect","High","Intentional localStorage hydration pattern triggers the rule; needs justified suppression to keep CI green","FIXED"
DEF-002,F024,"Unused variable 'player' in sync/squads.ts:19 (eslint warning)","Run `npm run lint`","No warnings","@typescript-eslint/no-unused-vars warning","Low","Leftover destructured/assigned binding never read","FIXED"
DEF-003,F008,"Match half-time line renders literal 'null' when only one of htHome/htAway is set","Open a /match/[id] with htHome set but htAway null","Half-time line hidden or shows both values","'Half time: 1 - null'","Low","Condition used OR (htHome!==null || htAway!==null) instead of requiring both","FIXED"
DEF-004,F017,"setCountry preference setter is never consumed by any component","grep setCountry usage","Used or removed","Dead code","Low","Preference API built ahead of UI; country selection never wired","FIXED (removed unused setter; country read retained in stored shape)"
DEF-005,F023,"CountryPicker component never imported/rendered anywhere","grep CountryPicker usage","Mounted or removed","Dead code","Low","Component built but not wired into any page","FIXED (component deleted; no references remain)"
DEF-006,F020,"Standings zone coloring thresholds hardcoded (CL<=4, relegation>=18) regardless of league size","View a league with fewer than 18 teams","Zones reflect actual league rules","Mislabels small leagues","Low","Heuristic placeholder; real qualification rules not modeled","FIXED (relegation now computed as bottom-3 from table size, gated to tables >=10)"
DEF-007,F020,"PositionBadge receives 'total' prop but never uses it","Read standing-table.tsx PositionBadge","Prop used or removed","Unused prop","Low","Prop reserved for size-aware zones (see DEF-006)","FIXED (prop now used for size-aware relegation zone)"
